,Kichwa,Spanish,Original
188,Kikin manarak vacunarinachu karkanki.,Usted no consta en la lista prioritaria de personal a vacunarse.,Usted no consta en la lista prioritaria de personal a vacunarse.
189,Kikin manarak vacunarinachu karkanki. Ripashun.,Acompáñenos.,Acompáñenos.
190,"Na na na, mana kankachu.",[MISSING],[MISSING]
191,"Rikuy, kitita pushak, kay ayllullaktapika mana urmashpapi lluchkarinmi.","Ya ve, alcaldesa, que en este barrio el que no cae resbala.","Ya ve, alcaldesa, que en este barrio el que no cae resbala."
192,Jaboneropak ayllullaktapi,En el Barrio del Jabonero,En el Barrio del Jabonero
193,Pandemiamanta rimaykuna,Historias de la pandemia,Historias de la pandemia
